{
  "$schema": "http://json-schema.org/draft-07/schema#",
  "$id": "https://gtme.spec/schemas/manifest.schema.json",
  "title": "Adapter manifest.json",
  "description": "An adapter's contract (SPEC.md §6). Built-ins embed theirs; external adapters ship it next to the `run` executable in ~/.gtme/adapters/<name>/. Derived from internal/adapters.Manifest, which decodes with DisallowUnknownFields — hence additionalProperties: false here.",
  "type": "object",
  "required": ["id", "version", "role", "entity_type"],
  "additionalProperties": false,
  "properties": {
    "id": {
      "type": "string",
      "minLength": 1,
      "description": "Adapter id, e.g. 'harvest/profile'. Provenance written to field_values.source is '<id>@<version>'."
    },
    "version": {
      "type": "integer",
      "minimum": 1,
      "description": "Manifest version; part of the provenance string."
    },
    "role": {
      "enum": ["source", "traverse", "filter", "enrich", "verify", "compose", "review", "deliver"],
      "description": "What the adapter does in a pipeline. Only enrich/verify are cache-skippable (SPEC.md §7). review (ADR-048) is compose-shaped — records advance on RECORD, no VERDICT is expected — with of: required on the step and never gating. traverse (ADR-054): records of `from` in, records of `entity_type` out, each related to the parent it was traversed from by `relation`; the run opens a new segment after it (SPEC.md §7)."
    },
    "entity_type": {
      "type": "string",
      "minLength": 1,
      "description": "A type file's name (SPEC.md §4a, ADR-054: person, company, post embedded; more arrive with bindings), or '*' for an entity-agnostic adapter (SPEC.md §6, ADR-033): its steps take the pipeline's entity type, and its static needs/provides are validated against that type at plan time. A source or a traverse may not declare '*'. For a traverse this is the OUTPUT type; `from` is the input."
    },
    "from": {
      "type": "string",
      "minLength": 1,
      "description": "Traverse only (ADR-054): the input type. The planner requires it to equal the current segment's type; needs is validated against it. It MAY equal entity_type (people to their coworkers is a traverse). Never '*'."
    },
    "relation": {
      "type": "object",
      "required": ["name", "from"],
      "additionalProperties": false,
      "description": "Traverse only (ADR-054): the edge written between every emitted record and the parent it was traversed from, and which end it starts at — record (authored_by runs from the post to its author) or parent (works_at runs from the person to the company traversed from).",
      "properties": {
        "name": {"type": "string", "pattern": "^[a-z][a-z0-9_]*$"},
        "from": {"enum": ["record", "parent"]}
      }
    },
    "needs": {
      "oneOf": [
        {"type": "object"},
        {"const": "dynamic"}
      ],
      "description": "JSON Schema for the projection the runner builds and hands in. `needs.required` is what the planner checks (SPEC.md §7). An object with additionalProperties:true and no properties is the needs-all wildcard. Dynamic needs (SPEC.md §6, ADR-019): the string 'dynamic', or an object carrying 'dynamic': true whose remaining keys are an ordinary JSON Schema acting as the always-required static floor — effective needs are then floor ∪ config-derived (`uses:` for filter/compose, `variables:` values for deliver). Property names in a static schema must be registry-canonical for the entity_type or vendor-namespaced (SPEC.md §4a)."
    },
    "provides": {
      "type": "object",
      "description": "JSON Schema for the fields the adapter produces. Output RECORD fields are validated against it before the ledger write (SPEC.md §5), and canonical fields additionally against the registry's type/enum/normalized form (SPEC.md §4a). Property names must be registry-canonical for the entity_type or vendor-namespaced."
    },
    "credentials": {
      "type": "array",
      "items": {"type": "string"},
      "description": "Env var names the runner MUST inject. A missing one is a plan-time error (SPEC.md §6)."
    },
    "credentials_optional": {
      "type": "array",
      "items": {"type": "string"},
      "description": "Injected when present, never blocks a plan (SPEC.md §6). Used by adapters that can work several ways, such as an AI step with a local engine."
    },
    "config_schema": {
      "type": "object",
      "description": "JSON Schema for the step's `with:` block."
    },
    "freshness_days": {
      "type": "integer",
      "minimum": 0,
      "description": "Default cache window for the fields this adapter provides; overridable per step with `cache:` (SPEC.md §6, §9)."
    },
    "emits_key_fields": {
      "type": "array",
      "items": {"type": "string"},
      "description": "Sources only: which output fields the runner should build the identity key from (SPEC.md §6)."
    },
    "cost_estimate_usd": {
      "type": "number",
      "minimum": 0,
      "description": "Static per-record cost estimate. `gtme plan` prints '?' when absent (SPEC.md §7)."
    },
    "batch": {
      "type": "boolean",
      "description": "Marks adapters the runner must feed in batches — the AI steps — one invocation per batch_size records (SPEC.md §6, §9)."
    },
    "idempotency": {
      "enum": ["native", "ledger"],
      "description": "Deliver adapters (ADR-045): 'native' means the target upserts (re-delivery cannot duplicate), unlocking redeliver:; 'ledger' or absent keeps the hard dedupe floor."
    },
    "idempotency_scope": {
      "type": "string",
      "description": "Deliver adapters only (ADR-044): the config key whose resolved value scopes deliveries rows — UNIQUE(target, scope, idempotency). Undeclared = unscoped (''). The key MUST hold a stable identifier of the destination (an id, an API slug, a file path, a URL), never a display name its owner can change (ADR-062); where the identifier has a shape, constrain the key to it in config_schema so a name is a plan error."
    },
    "keep_payloads": {
      "type": "boolean",
      "description": "ADR-030: whether raw responses this adapter attaches to its RECORDs (SPEC.md §5) are retained in the payloads cache tier. Default true; steps may override with keep_payloads: false in config."
    },
    "attests": {
      "type": "boolean",
      "description": "ADR-036, deliver adapters only: after a successful create the adapter re-reads the target and emits an ATTEST per record (SPEC.md §5) — confirmed | contradicted | inconclusive. Absent, every delivery stays `accepted` and is reported inconclusive (the honest default)."
    },
    "preflights": {
      "type": "boolean",
      "description": "ADR-040, deliver adapters only: the adapter can check the live target against what a step is about to send (SPEC.md §5 PREFLIGHT) — read-only, at --dry-run and arm time. Absent, no preflight runs."
    },
    "payload_ttl_days": {
      "type": "integer",
      "minimum": 0,
      "description": "ADR-030: retention window for this adapter's payloads (default 90). 0 means no expiry — kept until an explicit gtme vacuum decision."
    }
  }
}
