{
  "id": "human/filter",
  "version": 1,
  "role": "filter",
  "entity_type": "*",
  "needs": "dynamic",
  "config_schema": {
    "type": "object",
    "additionalProperties": false,
    "properties": {
      "template": {
        "type": "string",
        "description": "What the participant is shown per record (ADR-057): a template over record.* (the uses:/of: fields) and config.*, in place of the field listing. The runner loads {file:} before validation."
      },
      "render": {
        "type": "object",
        "additionalProperties": false,
        "properties": {
          "fields": {
            "type": "array",
            "items": {
              "type": "string"
            },
            "description": "The fields shown to the participant (default: the uses: fields, or the of: value alone); validated as uses: (SPEC \u00a77)"
          }
        },
        "description": "What the participant is shown per record (ADR-049): the listed fields, or the step's template: (ADR-057)"
      },
      "provides": {
        "type": "object",
        "description": "The step's derived provides schema (ADR-033) \u2014 the menu the participant answers. Injected by the runner from the step-level provides: key \u2014 never authored inside with:."
      },
      "of": {
        "type": "string",
        "description": "The referent (ADR-048): the field whose value this step is about. Injected by the runner from the step-level of: key \u2014 never authored inside with:."
      },
      "prompt": {
        "type": "string",
        "enum": [
          "tty",
          "never"
        ],
        "description": "tty (default): at a terminal, `gtme run` walks the records and asks; never: every record waits in the ledger for `gtme answer` (ADR-049). The mode, never text \u2014 the text is template: (ADR-057)"
      }
    }
  }
}
