{
  "id": "ai/filter",
  "version": 1,
  "role": "filter",
  "entity_type": "*",
  "needs": "dynamic",
  "config_schema": {
    "type": "object",
    "required": [
      "template"
    ],
    "additionalProperties": false,
    "properties": {
      "template": {
        "type": "string",
        "description": "The operator's text (ADR-057): a template rendered once per step over config.* \u2014 the shared block the records follow (SPEC \u00a710.3). The runner loads {file:} and renders before OPEN; the adapter receives text."
      },
      "batch_size": {
        "type": "integer",
        "minimum": 1
      },
      "model": {
        "type": "string"
      },
      "max_tokens": {
        "type": "integer",
        "minimum": 256
      },
      "fields": {
        "type": "array",
        "items": {
          "type": "string"
        },
        "description": "Restrict what the model sees to these fields (default: everything known)"
      },
      "provides": {
        "type": "object",
        "description": "The step's derived provides schema (ADR-033). Injected by the runner from the step-level provides: key \u2014 never authored inside with:."
      },
      "of": {
        "type": "string",
        "description": "The referent (ADR-048): the field whose value this step is about, presented to the model as the subject. Injected by the runner from the step-level of: key \u2014 never authored inside with:."
      },
      "fence": {
        "type": "boolean",
        "description": "ADR-035: wrap externally fetched fields in a delimiter labelled as subject-supplied data (default true); false opts out"
      },
      "deferred": {
        "type": "boolean",
        "description": "ADR-038: submit the batch to the engine's batch surface (the Message Batches API, half price) and end the run in flight; the next `gtme run` of the pipeline collects. Valid only on the pipeline's last step."
      },
      "fetched": {
        "type": "array",
        "items": {
          "type": "string"
        },
        "description": "The batch's externally fetched fields (ADR-035). Injected by the runner from provenance \u2014 never authored inside with:."
      }
    }
  },
  "batch": true,
  "credentials_optional": [
    "ANTHROPIC_API_KEY",
    "ANTHROPIC_WORKSPACE_ID"
  ]
}
